<?xml version="1.0" encoding="UTF-8"?>
<!DOCTYPE widget SYSTEM "http://schemas.tomatocms.com/dtd/widget_about.dtd">
<widget>
	<name>Weatherforex</name>
	<title>Weather and forex</title>
	<module>utility</module>
	<description>Show weather and forex from vnexpress.net</description>
	<thumbnail></thumbnail>
	<author>Ninh Gio`</author>
	<email>ninhgio@yahoo.com</email>
	<version>2.0.5</version>
	<license>free</license>
	<params>
	</params>
	<resources>
		<resource type="css" src="{APP_STATIC_SERVER}/skin/zing/default/ultility.css" />
	</resources>
</widget>
