<?xml version="1.0" encoding="UTF-8"?>
<!DOCTYPE widget SYSTEM "http://schemas.tomatocms.com/dtd/widget_about.dtd">
<widget>
	<name>Television</name>
	<title>Lịch phát sóng truyền hình</title>
	<module>utility</module>
	<description>Lịch phát sóng truyền hình từ vnexpress.net</description>
	<thumbnail></thumbnail>
	<author>Ninh Gio`</author>
	<email>ninhgio@yahoo.com</email>
	<version>2.0.4</version>
	<license>free</license>
	<params>
	</params>
	<resources>
	</resources>
</widget>
